Comment,Initial Reply,Replies,Likes
"Where have the people saying ""this song is now more relevant than ever"" been the last hundred years? More relevant than ever? This song was always relevant - this is just another tragic example in a history filled with them. Be better America... this is f***ing tragic to look at",Huge facts,25,1765
2020 someone? very niceee !!,yes 2020 trash,18,521
"No one:

Childish gambino’s spine: ➡️↗️⬇️⬆️⬅️↙️↖️⤴️↩️⤵️🔄","@Extraterrestrial it's a joke, shut yo sensitive ass up",387,73846
"Childish Gambino: 'Shoots someone' ""This is America""


America: You weren't supposed to do that",Oop- :face_with_hand_over_mouth::flushed_face::raised_back_of_hand:,206,40329
"Me: brings bulletproof shield to school
Teacher: “why”
Me: “ ThIs Is AmErIcA”",LOL,269,52237
"* _This video is blocked in your country_ *

VPN: *This Is America*",vpn hello there~,434,117981
"""Google whats the definition of america?""

Google: *Plays this is america""",You make me laugh,11,1647
"Damn, this guy looks a lot like Donald glover",He is Donald Glover :rolling_on_the_floor_laughing::rolling_on_the_floor_laughing::rolling_on_the_floor_laughing:,500,50952
We should play this when there is world war 3,"IM MR CONTAGIOUS you are righttt lol :face_with_tears_of_joy: so they can we will need sum speakers
so the enemies can hear the noise :rolling_on_the_floor_laughing:",26,1672
"No-one:
Not even a single soul:
America: *gun*",Yup,5,70
Remember when this came out and everyone was shook and now it’s just normal lmao,They hated Jesus for he spoke the truth,344,59424
"Dear stranger, whoever reads this: may your parents live over 100 years.",Jamer Mark hey dude they better,360,20671
"Is this the Krusty Krab?

No this is America.",Ahahahahshdgahdhx:face_with_tears_of_joy::face_with_tears_of_joy::face_with_tears_of_joy::face_with_tears_of_joy::face_with_tears_of_joy::hundred_points::hundred_points::fire::fire::B_button_(blood_type)_selector::B_button_(blood_type)_selector::B_button_(blood_type)_selector::B_button_(blood_type)_selector::chequered_flag::check_mark::multiplication_sign::wheelchair_symbol::baby_symbol::wheelchair_symbol:,74,9368
"Plot twist: those weren’t the prop guns...







This is america",You can still use a real firearm on set and be safe provided the right steps and rules are made and followed,27,4319
"*This is America*


Me: Yes this IS in fact America",Yes... America is in fact made of American America,111,18219
"Not Just Floyd,.. There is plenty of innocent people who were murdered in traffic check, looking suspicious in front yard and all we want justice for all of them.",This is just one of the few instances there's enough evidence to be sure the police had no right.,24,1861
I just changed the comment so the replies wouldn’t make sense,I have a chair made in Vietnam and a pocket knife made in the U$,83,6806
This film only has 6 shots. So does a revolver.,Oh shit just realized,1,16
"Oil: What is this place?

USA: This is America",your country  is north america,63,9244
"Donald Glover: Jack of all trades, Master of All.",https://youtu.be/RQN-DsmLF6Er,20,5429
Childish Gambino is that weird uncle on the reunion that spits out some truth,Bro he’s that uncle that tells the best jokes lmao its like he’s a comedian too :face_with_tears_of_joy::face_with_tears_of_joy:.,1,56
"ah so this is where Troy ended up after he left Community


I'm still confused",?,1,10
The sad fact this song has only gotten MORE relevant...,It's scary,1,262
"""Black man shot for jogging"" 
*This is America.*",:pensive_face:,186,7079
*I showed this to Joe biden he's now America's president*,YAASSSSSSSSS,1,20
"Christopher Columbus: *Discovers a new continent*
Amerigo Vespucci:
*THIS IS AMERICA*",only smart people understand,28,958
"this song has such a diferent feel now, holly shit",Nah. It has the same feeling.,1,11
2 years later and america is still the same... ThIs Is A fReE cOuNtRy,"Comparado a paises de medio oriente si.  Queres saber lo que es perder la libertad? andate a venezuela, cuba, etc.",14,145
"I see people commenting ""Did he predict the future?"". No, he's only retelling whats already happened in the past; we're just in a vicious cycle.","THIS. thank you. george floyd wasn’t the first and if we don’t change, he won’t be the last",151,18910
"Founding fathers when they signed the Declaration of Independence:




This is America",Lol,37,1199
"When you pause the video but the gunshots don’t stop




*this is america*",@Agyad Yahya literally,500,127272
"I guess all the people that disliked this don't like America, because that is what this video is. This video is America.",This is *A M E R I C A*,3,44
"As a horribly offensive, I find this American.",I can't wait for somebody to fail to realize there's a joke here,12,434
It's been 2 years and this song is still 100% valid.,It'll be valid for another 100yrs. If we all make it that long.,407,53271
"678k dislikes 






*Why are you booing him he's right*",lol nice one,21,587
This is America; so call me maybe,Yeah I came back here after watching that:face_with_tears_of_joy::face_with_tears_of_joy::face_with_tears_of_joy:,3,25
This song aged like the finest of wines.,Unfortunately,28,2218
"after 2 years, this is still america.












edit: CHECK MY RECENT RN",This is what America always has been,44,6015
This song is actually a masterpiece. Art is the best way to convey message,"I don't really think so, like I just listened to today because you know how if you listen to a song you haven't heard in awhile and you hear it with ""new ears"", a different perspective or catch something you missed but it's still the same to me him repeating this is a America and mumble rapping. I get the message of the song and it's not bad but I don't get the hype personally",1,17
This song should be played in the protests now.,"Some are playing this, what is the love and 2pacs songs:raised_fist_dark_skin_tone:",44,3780
"Who's stupid enough to ask: ""What does this song mean?""","Maybe I, cuz my English may be not good enough",4,4
"Trending again because this is in fact, still America","I see no Changes.



2Pac",46,4891
The president was just announced and listening to this song now hits different.,Truth!! Took on a whole new light... there is hope!!,7,127
"Its aged so well, he even got kids wearing masks on the top balcony.",I saw that! I had to rewind to make sure that I saw it right!,12,1392
"Rate this song on a scale  1 to America.

Me: This is America.",More like North Korea,2,74
When you are not from America but  now suddenly this song makes sense for you,"have you been blind the last 20 years? America's problems are FAR deeper than racism
Just imagine living in a country where everyone has the right to hold a gun and kill anyone they like whenever they feel like it..its insanity",57,4123
"me: *searches what is america*
Google: a country on North America
Bing:",This is america,9,68
the director is  Japanese but THIS IS AMERICA,what does the director being japanese have to do with it lmfao,1,21
"“Racism isn’t getting worse, it’s getting filmed” - Will Smith",periodt,401,40235
"Black's, Hispanic's, middle eastern's, LGBT, and all in between, let's make this country again! Trump is gone but don't stop keep preaching the words and your rights! Let's make this country great for our future generations to come! Tonight let's dance but tomorrow let's get back to work!",Biden will ruin America,18,60
2 years later and nothing changed:( this song just hit different in 2020 this is America I mean this is our world. and this song is back it the top hits                                                                 Thank you for everyone we can make the change together ✊✊🏻✊🏼✊🏽✊🏾✊🏿,all the world with you #blacklivesmatter support from iraq,56,3964
Waiting for the sequel: this is Australia by Isaac butterfield.,Australian Dude get F:face_with_symbols_on_mouth:,31,522
Shyca ist grad Cabana,"""Why do you shot the black guy?""
Police: ""He had a gun pointed at us, there was nothing else we could've done except d i e d""",38,830
imagine walking into a parking garage and seeing this dude walking towards you dancing,I'm dead:skull:,3,37
"other rappers: diss other rappers

this guy: diss is america",Hhh,191,37393
Amo esse Clipe...toda vez que vejo ele encontro algum novo significado 👏🏼👏🏼👏🏼,Finalmente um brasileiro,1,5
"It doesn't matter if the song is 2 years old , it will always describe America","Razmig Partamian what if America changed in the next 30 years, would that not make the song outdated in anyway",33,1919
"“Racism is not getting worse, it is getting filmed” -Will Smith","Pamela Aranzazu it’s so crazy how stuff is happening so fast, but black people are slowly getting what needs to be got! It always helps to look on the bright side, even when it feels impossible.",7,702
"2020, Biden/Harris just won the election. We have work to do. This is still America. 🖤🖤🖤","Remember this when Trump is elected for a 2nd term. Wake up, media LIED 2 U, Facebook LIED 2U...",3,33
This isn’t your first time here.,Yeah it is,500,48169
"Childish spine: wait why am in heaven?

Man in chair: First time?",Why is everyone saying the n word im black and im not even allowed to say it,2,0
"2005 - This is Youtube
2006 - This is Sparta
2007 - This is 2 Girls 1 Cup
2008 - This is Trollface
2009 - This is Annoying Orange
2010 - This(My Name) is Pewdiepie
2011 - This is Nyan Cat
2012 - This is DUUUMB WAAAYS TOOO DIEEE
2013 - This is Doge
2014 - This is All Star
2015 - This is Undertale
2016 - This is(We are) Number One
2017 - This is 2+2=4
2018 - This is America
2019 - This is Raid: Shadow Legends
2020 - This is...well, just madness","I can explain everything in the replies of this comment, if you need any help.",3,50
"Every body movement, every camera shot, every facial expression; this is art.",james. Exactly it really is,18,1570
This is a visual representation of America 2020...,"America has always been like this. 

Nothing new is happening. It's just getting filmed now.",16,2065
"Someone: **speaks different language** 
Karen:",South america?,3,35
"Is this the McDonald’s drive through?




No this is America",Lol:rolling_on_the_floor_laughing::rolling_on_the_floor_laughing::rolling_on_the_floor_laughing::rolling_on_the_floor_laughing:,7,293
"American:  attacks iran 
Irã: why 
Brasil: que música legal","American: What?
Brazil: THIS IS BRAZIL 
Ashuashuashua, vou tomar minhas pílulas",18,276
RIP to the people who dont know the actual meaning of this song,Jason Snyder What is the meaning of this song ;-;,83,4460
no way is this 2 years old. it feels like it came out last month.,It comes out everyday.,55,7176
Why does the guy who said this is America use an AK47 it’s a Soviet weapon,Cause America always takes stuff from other countries and makes it better.,2,3
"Who else before WWIII 

👇👇👇👇👇👇👇👇",No shit dumbass it ain't happen yet,10,381
"George Floyd, Ahmaud Aubrey, Breonna Taylor,
Tamir Rice, Dontre Hamilton, Michael Brown, Eric Garner, John Crawford III, Ezel Ford, Dante Parker, Tanisha Anderson, Akai Gurlery, Rumain Brisbon, Jerame Reid, Tony Robison, Phillip White, Eric Harris, Walter Scott, Freddie Gray, Sean Reed, Steven Demarco Taylor, Ariane McCree, Terrance Franklin, Miles Hall, Jamee Johnson, Antwon Rose, Stephon Clark, Yassin Mohamed, Finan H Berhe,Darius Tarver, William Green, Kwame “KK” Jones, De’von Bailey, Christopher Whitfield, Anthony Hill, Eric Logan, Jamarion Robinson, Gregory Hill Jr, JaQuavion Slaton, Ryan Twyman, Brandon Webber, Jimmy Atchison, Willie McCoy, Emantic “EJ” Fitzgerald Bradford Jr, D’ettrick Griffin, Jemel Roberson, DeAndre Ballard, Botham Shem Jean, Robert Lawrence White, Anthony Lamar Smith, Ramarley Graham, Manuel Loggins Jr. Trayvon Martin, Wendell Allen, Kendrec McDade, Larry Jackson Jr, Jonathan Ferrell, Jordan Baker, Victor White III,kEzell Ford, Kajieme Powell, Lacquan Mcdonald, Sandra Bland, Rodney Hess, Dion Johnson, Sean Bell, Amadou Diallo, PHILANDO CASTILE, Emmett Till, George Stinney, Chavis CarterDave Patrick Underwood
Calvin Horton Jr, Antonio Maze Jr, David McCatee, Dorian  Murrell, Marvin Francois, Chris Beaty, Robert Forbes, Italia Marie Kelly, John Tiggs, Aaron Jay Danielson, Cannon Hinnant

Secoria Turner, David Dorn, Jessica Doty Whitaker, Zackary, David Randalls, Mark James Gassett, David Martin Jackson  #SAYTHEIRNAMES",Finally someone mentioned about freddie gray,12,292
"People saying in the comments  ""Childish Gambino predicted the future"", No this is how America was founded. This is a Documentary!",Ain’t You loving the American Reality?,6,328
Am I the only one hearing both “this is America” and “this is a miracle”? I’ve been thinking about this for 2 years. Or I’m just looking for another piece of hidden sense and irony,oh wow now that you mention it i hear it,1,0
this song is still relevant to this day. we still the bullies. THIS IS AMERICA,"It came out 2 years ago....yeah... still pretty relevant lol.
Wait til 20 years pass by and not much change",4,114
"Gambino literally predicted what would happen if America doesn’t make changes by addressing police brutality and racism issues...and we are here now...this is America.
Edit: Read my explanation of what Gambino ""predicted"" through the music video in my comment for more context. 
TLDR: it's directly related to the imagery of our current protests in his mv (violence, riots, etc), foreshadowing to what was going to happen at that breaking point where if issues aren't fixed, there will be a big resistance through non-stop protests for anti-racism and anti-police brutality cause just like it is happening today.",He didn't predict anything. Gambino was down to earth.,14,698
Is a shame so many missed the message. It's even stated clearly at the end.,"I think I get the message, but I'm also confused why he shoots ppl in the video and how that fits into the message?",3,26
"2:29 gave me the chills!! No one in the video are wearing masks and briefly you see people or kids wearing them.  The first death of coronavirus was 2/29/20 announced by the CDC.
Death riding a pale horse is chilling! Coincidence 🤔??  This song definitely hit home now!!",People see what they want to see :woman_shrugging_selector:,4,20
"When the guy gets shot in the beginning he gets dragged away while the gun is handled with care.


 This is America",STFU.,500,120890
"If you're reading this,






you can read.",caca,1,13
Childish gambino about to make a “this is America” pt.2,For real?,14,1463
Who is here after Biden Won?,Joe,1,5
Unfortunately this song will probably never lose its topicality. No other masterpiece embodies so many *messages and facts.,"Я нахуй уважаю вас:flexed_biceps: надеюсь вы справитесь с ситуацией в стране, ебите нацистов, я нихрена не понял что ты написал, но я решил тоже что-то написать",11,799
"No joke this is one of the greatest music videos of all time.

It's a genuinely terrifying song. Like it's one of those songs you feel guilty for bopping your head to. I'm not American but some of my friends are and I can't imagine how frightening it must be to live there right now.

What makes me sad is the fact that if America doesn't get it's act together...this song will always be relevant.",You are just repeating what your sick sad inadequate Professors told you.  You attacked your own country. The place that has kept you safe your entire life.  You could of been born in Iraq.  And you attack America.  Do not have children.  Each and every one of you protesters - traitors - and sick from the  TV weirdos will be dealt with one by one when ya's least expect it.  You sick disgusting ungrateful garbage.,19,8
They made America a real thing after this song,What do you mean,35,4256
"2018: This is america

2020: Black lives Matter

Also 2020: Among us Dances",Wow. We’re an idiotic species of creative geniuses.,3,55
"I don't get how people hate other people because of their SKIN COLOR. Like tf this is so stupid in the end we are all human and a color shouldn't be a problem. And I also think calling a skin color a ""race"" like ""the black race"" and ""the white race"" is stupid too bc we're the race human y'allllll",Also the hate to Muslim,53,1186
People saying I’m the comments “Childish Gambino predicted the future” but he didn’t. This has been a problem in America for years but it’s only more relevant in the media now. He just acted earlier than we did.,^^ thanks,132,12671
only people who didn't come from tik tok can like this.,I hate Tik Tok.,4,25
"the sheer amount of metaphors, analogies and other societal commentaries are astounding. and entirely relevant.",You could watch it 50 times and still be picking up something new on the 51st watch.,13,1570
Virginia: We are about to prove this man point,Good prediction,3,33
When the Song is 2 years old but this is still america.,"This has always been America but hopefully the protests will change it for the better. 
Now is your time, Americans, please don't make my comment age like milk.
Sincerely, a concerned Canadian.",42,4587
"Iran: *Invades mainland America*


Also Iran: ""Why do I hear boss music?""",send em to chicago,6,84
2 years later and it’s still reflecting america. what the hell is wrong with this country.,the country isn’t going to change in 2 years,223,8728
"is this america?


*no this is Patrick*",sifedine tajjiou funny,9,134
0:53 Karens when they hear someone speak Spanish.,True,1,14
"He didn't predict the future,  he was living in the present.",sub 2 me,3,870
"Killed over a $20 Bill







This is America",it’s messed up. I’m embarrassed to say I live in america,52,4436
"Please stop I can't breathe.
My stomach hurts.
My neck hurts.
Everything hurts.
They're going to kill me.
George Floyd
SAY MY NAME",#JusticeForGeorgeFloyd :raised_fist_light_skin_tone::raised_fist_medium-light_skin_tone::raised_fist_medium_skin_tone::raised_fist_medium-dark_skin_tone::raised_fist_dark_skin_tone:,1,266
"GET WELL soon America,  let the healing process begin. Make America ""SANE"" again.",Hopefully at least somewhat. We will be forever scarred.,5,9
"This song is still relevant in 2020, just shows we havent changed at all.",were kinda going backwards actually :/,303,25552
"America: Attacks Iran 
Iran: why 
Trump: This is America","Iran, and all middle eastern countries, have lost their minds",43,569
This song predicted the Black Lives Matter protests.,blm founded in 2013 and the same protests have been going on since rodney king,1,11
"This is still America. 
But even worse. 
Sincerely, 2020","Its always been like this, we are just now able to record it.",2,449
Imagine hearing this at the airport after arriving America,"*This Is London*

https://youtu.be/AIn2qmUIX0k
Imagine a ART VIDEO parody it super close to ""This Is America"" was done a while back ago, it also including with *a few minute of dark silent* for everyones to gain their composure  back . I really do appreciate for everybody to take a look at it.,  and thanks :heart_suit_selector:",146,24043
This song is the best ever,Facts,1,4
It’s president Election Day and this song is hitting differently for me,same. biden is winning but riots will happen anyways. please stay inside and stay safe.,84,4766
Wow I can’t believe they actually made a country after this song,Haven’t heard this one,500,88993
the fact this song is 2 years old and there are comments from mere hours ago shows how important and still relevant this song is.,It’s unfortunate that this song is relevant,54,9364
2 years later and this is STILL America...,"Jordyn Monique it always has been America, just over time things have gotten worse:/",5,540
"*Iran attack*

* Latin Americans, Canada and Denmark point to the USA*

this Is América. 

*Comment more than a month ago*

This no.",@Ki-Adi Mundi :face_with_tears_of_joy:,6,143
the definition of the america we live in currently.,"TJDNC Sadly....yeah. This is why I am moving to Maine. I know it is still in America, but I think it would be cool to be killed by a Stephen King monster.",38,3226
"*""They laughing at my 9cm,Wait till they see my 9mm""*


               ~The quiet kid",Karate kyle,465,62518
"Democrats will not magically fix everything. Celebrate a trump loss, not a biden victory. there’s still plenty of work to be done.",Biden is gonna do nothing except make this country worse,8,51
Atleast This Guy is Speaking Some real shit.... But in my Country (India) no artist Has this much of Guts to express the problems in our Society.....🇮🇳💔,:disappointed_face::disappointed_face::disappointed_face:,1,2
"I hate that this song is saying the truth but life is like that
Rest in peace George Floyd
#blacklivesmatter",John Fernandez blm. we’re all in this together. we got this.,40,1396
"From Malaysia, Rest in Power #GEORGEFLOYD Say no to racism. No matter where you are or who you are. This is inhumane and  disgusting. #BlackLivesMatter  #ICantBreath #GeorgeFloyd",funny how this happens in the US and *almost* nowhere else,10,397
"it’s horrifying how this song is becoming more and more relevant.                                                              edit: since i keep seeing comments about how’s its always been relevant i’m going to clear something up. In the past it has always been relevant, but we wouldn’t see protests and riots over it everyday, we all knew it was an issue (and obviously still is)but just like in the music video we would kinda of brush it off, or record it and not do much of anything about it, even though we were aware of this sad reality, until the murder of George Floyd.",More and more by Twice leggo!!!,17,1175
I’m here after George Floyd was murdered by Minneapolis cops. May he rest in justice.,Derek Chauvin should be sentenced to murder and the other officers jailed for life,5,497
"I CAN'T BREATH 
I CAN'T BREATH
SAY HIS NAME: GEORGE FLOYD",#icantbreathe r.i.p George floyd,10,247
A primeira vez q vi esse clipe tendi foi nada kkkkkkk,O clip é sobre racismo e o porte de armas no USA,1,2
"Shoots someone 
“THIS IS AMERICA”

No no, he’s got a point",especially because of the man's race,1,718
"Key words: “this is America”
“Police be trippin now” “guns in my area”
“Look how I’m live now” 

This is basically our world now",This was always our world,11,734
"2 years later




This is STILL America",Yeah rude but true,35,3014
"This song made me cry for the second time since it’s release. Racism is not getting worse, it’s getting filmed.","And idiots don't get smarter. Disregard the statistics and problems faced by other non-black US residents. All attention to the fact that a police officer caught a repeat offender during the arrest and accidentally killed him. Oh, sorry, it was not that he was a criminal that played a role, but that he was black. If they killed the white man like that, no one would care. Now the US has a new hero: a drug addict, counterfeiter and robber who threatened to kill a pregnant woman, Floyd George.",3,245
Had to come back to this after all the horrible shit that’s been happening lately.,"that horrible shit has always been happening, not lately... it wasn’t visible before",3,322
"The reason why this feels so new is because no matter how old this song is, it is still the truth.",True,15,727
it seems like we all come back to this song when another black victim is killed :(,*YEA YEA YEA YEA YEA YEA YEA YEA YEA YEA YEA*,46,3694
I came back to this song to see if I can understand why another innocent black man was killed. Of course the answer I got was : “This is America. “,there are lot of comments like yours but yours broke me a little :loudly_crying_face: you worded it in a beautiful (but devastating) way,57,1477
This song is becoming more and more accurate,*It is accurate*,493,51354
“I wish America loved black people as much as they love black culture” - Jalen Rose,True shit,31,2464
"“Racism isn’t getting worse, it’s getting filmed” - Will Smith 
SE VC É BR AQUI ESTÁ SEU COMENTÁRIO-  833 likes now",Copied its 3 hours later than the other one,13,869
I hate that nothing has changed since this song came out,The only thing that changed is that racism got worse,36,2408
It’s so crazy that childish gambino invented America!,Ikr!!,36,1728
Does anybody else find it scary that this song keep getting more and more true over the years?,i just had that thought,82,2418
We Definitely Need A This Is America Part 2 In 2020 ...,Periodt,4,177
