Comment,Initial Reply,Replies,Likes
"I am Brazilian! A week ago, a 14 year old black boy named João Pedro was killed by ""policemen"" in Rio de Janeiro, inside his own house, playing with his cousins! NO REASON! Soon after, a 19-year-old black man named Rodrigo was also killed in an action to distribute food baskets, also in Rio and WITHOUT REASON! Another case (happened if I wasn't wrong the day before yesterday, I'm not sure) of a delivery man named Matheus, was shot in the head because, according to the ""police"", he looked like a drug dealer! As if it wasn't bad, another delivery man (I can't say his name) was also killed in a stop order by ""policemen"" in a slum! (Both cases also in Rio de Janeiro) These two were not black, but their lives are also important! Just look at the ""reason"" for the deaths! Coincidence? Some ""policemen"" do not fulfill the real objective of the Police, which is to protect good citizens and go against those who really do bad things for society! The problem is not the uniform, but who wears it! The problem is not the police, the problem is certain policemen! 😓💔","Foda-se, americano não liga para brasileiro",13,603
This is trending again. That’s how you know someone killed an unarmed black man or school children again. 💔,i just came here searching for this comment,234,19722
is anybodys youtube down,fell for an hour :{,1,4
He is always wearing the same shirt,Right! The one he's wearing in the video is just...no...,1,2
Damn all these boomers told me this was a bad song and this is actually good,what makes them think it’s a bad song?,3,12
"Me:when will I be well
Doctor:until America comes out",He probably sucks at fortnite and ROBLOX,1,6
Why does it feel like this song just came out,Election season and Donald Glover coming back on Twitter?,1,2
The first time you were here TikTok wasn’t a thing,its true. first time I was here I didnt know what this song was about,10,695
"This is America
🔽






🔫",I know,1,6
Crazy how they named two continents after this song,Jacob Feurstein haha nice joke,5,29
"Joe Biden becomes president 

USA 2021:  2:00 to 2:12",Except it was more like this under Trump:thinking_face:,1,2
"I'm not black but I see you.
I'm not black but I hear you.
I'm not black but I will mourn with you.
I'm not black but I will fight with you.
✊🏻✊🏼✊🏽✊🏾✊🏿#BLACKLIVESMATTER","No justice, no peace :speaking_head_selector::speaking_head_selector:",9,190
"""This is America"",The title is wrong, it should be ""This is the United States"", America is a continent._.
en fin los gringos y su geografía xdd",We are America :Argentina::Brazil::Chile::Colombia::Cuba::Costa_Rica::Ecuador::Guatemala::Honduras::Panama::Puerto_Rico::Uruguay::Venezuela::Dominican_Republic::Jamaica::Mexico:,2,16
DID HE REALLY SHOOT HIM!?,its just edits lol,3,2
Who’s here after seeing all the police brutality and this pandemic😫?,Me,8,721
"Brasil: AMERICA É O CONTINENTE INTEIRO!

Iran:MORTE A AMERICA!

Brasil:
This is america (Ò-Ó )__EUA
                            /       \",@pedrym r/whooooosh,5,28
WHOS HERE AFTER BIDEN BECOMES PRESIDENT,YESS:blue_heart::blue_heart::blue_heart:,5,33
Did you actually shoot a person or am I just imagining things I’m scared but I like your music 🎵,bruh,1,0
Remember when people were shocked over this video? They aren't shocked now that's for sure.,:clapping_hands::clapping_hands::clapping_hands::clapping_hands::clapping_hands::clapping_hands:. Truth HURTS,4,293
This song should be played in the protest on the street.,This and Mick Jenkin's Drowning.,11,433
"People from other countries: America is all the continent bro wtf...
USA: *THIS IS AMERICA*",gay,2,11
"SAY THEIR NAMES! Ahmaud Arbery, George Floyd, Breonna Taylor, Eric Garner, Mya Hill, Brian Day, George Mann, Dominique Clayton, Tanisha Anderson, Nathaniel Harris Pickett, Freddie Blue, Ezell Ford, Frank Smart, Dante Parke, Botham Jean, Walter Scott, Tameer Rice, Laquan Mcdonald, Anthony Ashford. That’s not even the start of it. How many more protests need to be held? How many more hearts need to be broken? How many more tears must be shed? How much more PAIN and OUTRAGE do we need to feel until JUSTICE is served?!!!???",Shut up,18,431
I wish I did one thing as well as Donald Glover does everything.,Cyranek indeed comrade,221,42148
donald just letting us know hes talented at every single thing hes ever done,FG you better a lyric video about this man.,141,20015
This song is actually a masterpiece. Art is the best way to convey message,"@DoubleA Gaming but.
That's the reality",500,108512
Who is here after #blacklivesmatter ?that's so sad . Racism doesn't be in 21st century.,And the protest turned into mayhem and unpeacful :(,91,2537
"Who’s here after those 4 police officers murdered George Floyd on camera and were only fired and nothing more also the news only refers to him as “black man” and doesn’t even use his name 

*THIS IS AMERICA*",THIS IS AMERIKKKA. #justiceforfloyd #justiceforahmad,12,667
"“Racism isn’t getting worse, it’s getting filmed” - Will Smith",Lol,41,1552
The most relevant song in American History.,Strange Fruit - Billie Holiday,63,4732
"George Floyd
Trayvon Martin
Breonna Taylor
Ahmaud Arbery
Tamir Rice
Oscar Grant
Eric Garner
Philando Castile
Samuel Dubose
Sandra Bland
Walter Scott
Terrence Crutcher",SAY THEIR NAMES!! Black Lives Matter,29,497
"Innocent people getting killed because of their skin colour. 

This is America.",사랑Ciara boo you’re in canada,10,783
"""I can't breathe"".
-George Floyd, America 2020.",Bruh how many comments are you gonna post,2,170
"people saying ‘all lives matter’ rn , that’s true, but rn we have to focus on black lives matter, because of everything that has happened .","Those ""all lives matter"" comments are garbage, mostly made by those who completely ignore the problem (racism). 

Different colour shouldn't be a reason to hate. What kind of manchild hates different colours?",10,159
The fact that this is trending again is a sign that there is a huge problem in America right now.,Nand0 how is not?,9,673
"if you guys didn't know, the silence from 2:44〜3:01 is 17 seconds, which implies the number of students who were shot in the Florida parkland shooting.

EDIT: Istg this song gets relevant every single day but some people don't understand enough. No matter what color, religion you are, everyone should be respected equally. Complexion doesn't mean a thing. I'm just a 17yr old Japanese guy, but I hope you embrace my  message.",Wot,426,36873
"*This song hits different in 2020*

🇹🇷",This song has always hit different,378,31317
"It's not white VS black, it's everybody VS racists 💙",:face_blowing_a_kiss: love you,10,333
"America: Kills Sulaimany
Iran:Why
America:This Is America",Sulaimani was not an innocent man,14,55
"0:52 oh hey when you disagree with someone in 2020


1:56 oh this is a classic American tradition",*THIS IS AMERICA*,1,2
I really hope that someday this song won’t be relevant.,"It gets worst actually. Not trying to be a douche but take a step back and look at everything. Social Conditioning by the media that welcomes violence and destruction when agenda needs it, Social Media taking a slice of that pie making it worst, controlling elections, only goes downhill from now on coz whose gonna stop it? Like really who? The people? Nope not by a long shot coz the people welcome it coz they are conditioned to think that way till they actually regret it one day and they won't see it coming. How do you see this end like personally? All i can see is US dont wanna compete with the next super power while the other one wants to fight it and guess what, he's about to lose coz the big bois in the table all chimed in and reached an understanding that he needs to go. Only thing good about all this is we'd be dead before it all goes nutty bananas but tough luck with the people we leave behind. I guess Jackie Chan was right, people want to be guided ""The easy way to live life is going by the book, question is who wrote it"". Freedom existed back then but the big bois says its a bad thing so no what?",1,0
"2:14 ""I'm so fitting, I'm on Gucci, I'm so pretty (yeah yeah), I'm gonna get it, watch me move""

I think this implies the media blocking out what actually goes on in America. Making it seem like this wonderful place dispite it's history.",yeah and also at 2:05 you can hear gunshots and people screaming then it stops quickly when he puts his arms up,3,2
"Exactly how I feel

I’m 34 and I fear for my kids and my safety everyday

I live in a nice area so I won’t let my teenage son out after dark

Too scared someone will accuse him of some ungodly thing or kill him for walking down the street 

I work hard for my life but I have to limit my sons freedom because This Is America","make sure you TELL HIM WHY Youre afraid for his safety.
make sure he knows that there IS a War on, in this land, and that there are Real predators, out there.
not only is he still too weak and inexperienced to defend himself, but he DOESNT KNOW Who's who, out there.
theyre hiding their identities, deeds and intentions.
get yourself a support group together, ASAFP!
Good Luck, Mom.",3,7
This is my country! I am proud to be an American! God bless our country! Lets go Biden!!!,YES,1,2
Absolute masterpiece. This is one of the best music videos ever created.,Could you please tell me what it is about? It is my first time seeing it but I don't understand what is going on,1,0
It’s just crazy how relevant this song has gotten more & more.,yeah and all the dancers reminds me to tiktokers,3,332
This song is now more relevant than ever,It was as relevant in 2018 as it is today.,8,849
Now Trump lost. Such a great day!,Hi im from Indonesian,22,45
"This month is literally this music video personified, prove me wrong",I can't. I dont want too,5,293
I am here in July but nothing has changed. This Is America,Faith Zikali If you are still alive you will be saying this 50 years from now. :pensive_face:,45,1198
How can people dislike this he is telling facts,That's why people disliked it.,18,985
2020 and more black victims. Silence is BETRAYAL,I know. I feel like I can't go outside safely because I'm black.,8,722
Who hates the fact that America be burning dese days tho,I didnt see any republicans burning down buildings when they lost the election :man_shrugging_selector:,4,18
"George Floyd: ""Please, please I can't breathe""
4 Minneapolis cop's logic: He is still talking, he is fine","Even when he pass out, they still not release him, what the fuck up thing to see.",16,352
"And here we are, another sad death of an unarmed black man while we out here tick tocking being distracted smh. This is America.","if you’ve been on tiktok recently, you’d know people are supporting the black lives matter movement on there. the minneapolis protests have blown up on tiktok. tiktok helped information spread faster, if anything.",3,247
Wow I can't believe he invented gun violence a year ago,Xenoslyce there’s been fun violence,2,5
"This art has never been more poignant, horrifying, and meaningful. This ISN'T the America that I want to be a part of.  This HAS TO STOP. Police brutality has gotten out of control. You should feel rage. You should feel undying rage if your soul is intact. THIS IS NOT AMERICA!!! Not my president, not my Jesus, not MY AMERICA!","it ain’t even police brutality no more, it’s literally murder.",4,325
"This song hits different now...., we are all humans, not colors to be judged about.","sadly a lot of people think differently, they are stuck in 1800 ^^",4,796
тут все англичани а я РУССКИЙ!),Факюрашаянин,2,0
"Me: Brings in war weapons

Teacher: Why you bring dat

Me: Cause this is America",Hhhhh,1,8
"If your own race doesn't kill you first, don't worry the police will. Why: This is America",Shut up will you,8,65
This is south africa  unfortunately,???,1,1
Who is watching this in 2020 and being like he’s right,Superior Unicorns me black life’s matter :raised_fist_light_skin_tone::raised_fist_medium-light_skin_tone::raised_fist_medium_skin_tone::raised_fist_medium-dark_skin_tone::raised_fist_dark_skin_tone:,7,526
this hits differently today,all the world with you #blacklivesmatter support from iraq,4,369
"“We said Black Lives Matter. We never said “only Black Lives Matter”. That was the media, not us. We know that all lives matter. We’ve supported your lives through history. Now we need your help  for black lives that are in danger”",I gotchu sis.,8,377
People saying “this song is two years old and still relevant”... this song is going to be relevant for the next 100 years in America 🤣,That's part of the problem,13,650
This song is relevant again,Yes. I was very sad and angry seeing the police who should protect us do this to black people,8,442
I'm watching this after the black jogger got shot in Georgia,acash93 me too,73,1787
"When there’s a virus that affects the respiratory system but everyone’s hoarding toilet paper

This is America",Half Blood Scum is ur name a reference to harry potter ?,58,3619
Jesus this song is seriously aging like fine wine,Meami StankFace I WAS JUST THINKINH THAT,19,1909
"Listening the song After a Police killed a Black Man, This is america",Rip George Floyd :folded_hands_medium-light_skin_tone::folded_hands_medium-light_skin_tone:,5,338
This song can be heard across Minneapolis.,As it should NO JUSTICE NO PEACE,1,304
Sounded like 21 savage saying straight up at 1:39 😭,Stackzz it is,1,1
"My fellow humans: This wasn't a ""prediction"". It was and is a historical document. It only seems like a ""prediction"" if you are just now realizing there's a problem.",So much this :raising_hands:,12,630
this hits harder now. June 2020.,Yeah bro,3,296
"*shoots gun*

“This is America”

Seems about right","Shoots church choir ""This is america"" 
 Also fitting",44,5112
why are people disliking? this is what america is like.,No they hate it because they want tol make it 696k,37,2121
When he shot the choir and the beat dropped. i was like :O  did not see that coming!,GodBlessHipHop You didn't react like that when he shot the first guy?,69,3454
special delivery,Wtf he done did,43,5916
"Stop saying that he predicted this. THIS IS AMERICAN HISTORY SINCE THE SLAVES (even before then, thank you na). Let’s donate.",Actually we should donate to the people who are in need and thus song is amazing and well thought I mean every seen and it's just genius,57,3422
"justice for black people. RIP George Floyd, Breonna Taylor and Ahmaud Arbery","Do you have the same energy for the black kids and other innocent black people being murdered by other blacks? Nope, only when it’s a white person. SMDH",37,2105
ALL LIVES CANT MATTER UNTIL BLACK LIVES MATTER 👊🏻👊🏼👊🏽👊🏾👊🏿,who said they didnt?,21,438
The dislikes are from people who couldn't handle living without getting a haircut or their nails done. Why is this video still so spot on after 2 years? smh,"The people who 'can't handle it' are the majority of Americans, that live paycheck to paycheck. People want the government to reopen because they need to work. The image of the crazy white person that just can't handle waiting to get their nails done or whatever, is a false one.",35,3164
"American: its mom, not mum!
British person: ITS SCHOOL, NOT SHOOTING RANGE",Yeah pretty much,12,1672
Who else is coming back to this randomly during quarantine?,Here,89,3817
"To: Ahmad Arbury, shot to death by father and son. George Floyd, kneed to death by three policemen, in the end causing country wide riots, killing several people too. Heather Heyer, ran over by Neo-Nazi in terrorist attack. Daniel Shaver, unarmed man shot to death by police for pulling up his pants, suspected by police of pulling out a gun. Breonna Taylor, an officer killed in her house by policemen, as her boyfriend thought robbers were coming in he started shooting at the officers, who shot back and killed Breonna. Eric Garner, asphyxiated to death by policemen. John Lennon, the famous former Beatle shot dead outside apartment by obsessed fan. Rapper Nipsey Hussle, shot dead in Los Angeles strip mall for no reason. Abraham Lincoln, James Garfield, William McKinley, and John Fitzgerald Kennedy, all shot during presidency. The 23 killed in a racially driven shooting at an El Paso Walmart. The 9 innocent people killed in a Dayton Nightclub. To the 26 children and mother of shooter killed during Sandy Hook shooting rampage. The four innocent people killed near and inside a Jewish deli in Jersey City.  The two teenagers shot in Saugus High School. The seven innocent people killed in the Midland-Odessa shooting rampage. The three innocent people killed in the Gilroy Garlic festival shooting. The 58 people shot dead in a 100+ round shooting in Las Vegas, Nevada. The 49 innocent people shot in the Orlando Nightclub shooting. The 32 innocent people killed in the Virginia Tech shooting. The 12 people killed during the Borderline Bar shooting. The 12 people killed during the Aurora movie theater shooting. The 13 students and teacher shot during the Columbine High School massacre. The 21 innocent people killed at a San Ysidro McDonalds. The three killed in the Boston Marathon Bombings. The 38 people killed in the 1920 Wall Street Bombing. The nine people killed in the Charlestown church shooting. The 11 killed in the Pittsburgh Synagogue shooting. The six innocent people killed in the Isla Vista massacre. The 168 people killed during the Oklahoma City bombing in 1995. Sadly, I have only said a handful of these incidents. I bet we all want this to stop now.","Yes please, stop this nightmare now

It's 2020. Why does racism still exist...",6,133
The biggest joke I ever heard is “equality in America “,true,35,688
"8% Girls
5% Violence
5% DoPe



82% *AmErICa*",I see plenty of women,28,1617
Another innocent man gunned down for just jogging. Welcome to America,Nathan Frank welcome to this “great nation”,23,446
"This song was 100% true when it was released but now, that’s turned into a 200%",:3,8,513
99% of America still DO NOT understand the message here.,While half the message is literally just a misunderstood concept of America.,470,34729
"I can't breath


This is America","No justice, no peace. The riots are only going to stop when America is a country where everyone can breathe.
Rest in power George Floyd, we'll start a revolution in the name of you and every single innocent POC that has fallen victim to America's busted ass justice system.",83,5036
People be like: o no he is racist   “This  Is America” ; My people be like :well another 42 students disappeared and the government hided the case “Latinoamerica “,Saludos desde Panamá,3,19
America really is a third world country with a first world country skin on,It may have problems but please check your privilege and understand that all other countries are dealing with these problems too. The difference is the people aren't as passionate and the governments there dont allow free speech,9,147
Anyone else here from Call Me Maybe cuz it just got recommended again,"At first i was confused, but then a minute later it actually got recommended on me... So... Yes im here",1,1
"the fact that they’re risking their lives by making these songs gives me so much respect to them


edit: if you’re gonna be pressed like this kid in the replies, just don’t say anything at all. dont like, scroll, and move on.",How are they risking their lives?,2,0
"Teacher: why are you wearing a bullet proof vest?
Me: this is America",Copied comment,31,2632
Biden has won! :D,:D,3,5
This is USA**,You are right!,1,3
"It’s sickening how this song is still relevant to our current events. You would think that after two years, we may have changed.",Sometimes I feel like things are  just getting worse. This world is insane. That's an understatement.,15,407
1:56 Se esse clipe fosse Brasileiro os mimisentos virariam foras raivosas vendo essa parte 😂😂😂,É muito verdade,1,0
"When an unarmed black man dies at the hands of police...

*This is America.*","Yeah, I'll have the usual",2,291
2:35 - 2:39 Can someone explain to me why someone wearing black is riding a white horse?,It's common in a lot of stories that a character wearing all black and riding a white horse is the representation of death.,1,1
This is a masterpiece....it blows my mind,Wigger,2,0
it’s crazy how this was 2 years ago and nothing has changed,If anything shits gotten much worse:disappointed_face::disappointed_face::skull::skull::skull:,48,2547
“I can’t breathe because THIS IS AMERICA AND I’M BLACK “ 2020 😔✊🏻George Floyd,imma go ahead and say that the pfp isn't you then,6,181
George Floyd... He didn’t deserve it... This is America...,I hate america.,1,143
"I see people writing comments about this is reflective of how America is now, no. It’s been like this for as long as anyone can remember. It’s just at the forefront now more than ever.",First reply,4,690
"RIP George Floyd, this is AmErIcA.",ameriKKKa,1,211
"America:attacks Iran
Iran:why?
*THIS IS AMERICA*",That was really screwed up xD,10,2
When are we ganna look at this and say this isn’t America anymore,Probably never because America is a cursed country. It's built on such rotten grounds that a collapse is inevitable.,14,634
I think this is one of the best films Abed has made.,"Holly shit, haven't thought of it until you said it!",31,2204
"31 years ago, when I was 11, my generation got our wake up call. 
Janet Jackson's Rhythm Nation 1814. Not just the single.....the entire album. It shaped a generation, turned a generation, moved a generation. 

Something went wrong. I am not sure when exactly. I was so sure the progression of the 25 years following the release was going so well.....I just did not get it, until it hit me directly in the face. 

I am now 42. I am going into the middle of my lifetime expectancy. As is all of the Janet followers of the ideal that:
""In complete darkness we are all the same. It is only our knowledge and wisdom that separates us. Don't let your eyes deceive you.""

It is shortly going to be no longer in our hands to try and bring about any kind of progress and change. That is for those younger than myself to begin taking up. This is your message. 
And though Janet had to kind of dance around the topic, it was still there for us to hear and see within the videos. 
This.......this is literally hitting it on the head. It is the right message. And it has to be heard. 
Get off your asses
Get off your phones
Get out there and communicate with the people around you directly. 

In America we have just held the most insane and ""what the fuck"" election cycle in my lifetime. Our President Elect is Joe Biden. 
I am begging my Democratic friends to not forget there was almost half that did vote Republican, and or are still President Trump supporters. Don't leave them behind in your progression forward. Americans are a breed of red and blue.....black and white. All colors of all countries are here within the confines of ours. 
All faiths, all orientations living together more coherently than any other combination of 20 countries out there. 
Moving forward requires everyone going forward. No one can be left behind while others move forward. It remains our biggest mistake through the centuries. This includes the Trump supporter or the Republican voters. And I know.......they did not extend the same hand 4 years ago. I get it. 
But if you witnessed the disintegration of the last four years play out.....you know that you cannot repeat the same mistake. Pick the people up, dust them off, and bring them along. Let them know as well that they are part of America too.",This was beautiful I’m ngl I got kinda confused toward the end but I agree our country is more divided than ever almost half the votes went to trump the other to Biden we need to do something fast we shouldn’t be scared for the future we shouldn’t have to protest for people to be equal your a very smart person I agree with everything you said,2,17
I feel like this song is the definition of 2020 and racism,It's crazy how racism is still a thing... I saw a lot of clips of black people getting beaten up by cops for no reason and a girl getting harassed by wearing a Puerto Rico shirt and the cop didn't help her at all.. Literally native Americans lived here before and Columbus found this country and their not white... Idk why white people think they own this country :man_facepalming_selector:,3,285
If ww3 ever happens ima go outside blasting this song,U mean the civil war,1,0
I didn't know lando calrissian was a rapper.....,this isn't Lando calrissian. this is a wannabe,1,3
people who disliked this didn't understand the meaning of the song or they just racist,maybe they disliked it because of the fact that it’s still happening to the world right now,7,232
This song hits different in 2020.,really.,6,467
"- The 17 seconds of silence represent the 17 victims of the Parkland shooting
- The church choir represents the Charleston Church shooting
- The pose he makes after shooting the man in the beginning is a reference to Jim Crow
- The hooded figure on the white horse is a reference to the horsemen of the apocalypse 
- The delicate treatment of the weapons used represent how America favors guns over people's lives
- The eccentric dancing represents how the media and entertainment distract you from the real issue
- The people on the top balcony with phones/masks represent how most would rather record than to help
Feel free to add more references",Factz,76,1659
