Comment,Initial Reply,Replies,Likes
"And the police officer got away with murder, hiding behind riot police in his own home. Has he got any shame?","They won't be able to protect him forever. 
If they don't punish him by law, people will do it themselves",14,240
"2020 is such an awful year man 🤦🏾‍♂️

Can we like forget that 2020 was a year",And it’s only half over. Wtf is this year,12,458
"1:47
America join the game
Iran: we play better than you
America: AimBot Activated by This is America",ThanksIHateIt,1,2
"Hi, I'm sorry for the English mistakes, I'm from Brazil and I'm writing this text through Google translator.
 I'm not sure if in the United States I'm white, maybe I'm Latin for you, I don't know, but here I'm white. A few years ago, I thought that all this racism was something that people exaggerated a little ... nowadays I realize that I was TOTALLY wrong, here in Brazil, with our current president, things are getting stranger and stranger , Brazil is with less and less hope, I have friends who have already told me that they are used to suffering racism, because it is something frequent, it really hurts, it leaves any human being with the minimum of intelligence, extremely bad.
 Anyway ... I'm ashamed to be part of a world where things like what happened to George Floyd happen so often ... But what I really want to say is that, even though I'm not the right person to talk about racism, after all I never suffered anything like that, I wanted to tell you that you have this problem in your life, that you stay strong, it's easy to talk but, keep your head up, one day things will be the right way, it's a matter of time and struggle .
 Again, sorry for the mistakes in English, and I hope I got the message I wanted.","i get you man, us light skinned latinos, even though we're not really white, very often benefit from white supremacy and racism even without realizing. racism is a problem EVERYWHERE. us more privileged people need to make sure oppressed voices are heard . black lives matter
edit: i know there are white latinos btw i meant the ones who aren't/are mixed. but the same goes to them",5,269
"Looks like Childish Gambino wasn't just commentating, he was prophesizing.","He wasn't prophesizing anything, this shit been going on continuously for ages.",10,479
"The amount of people saying that ""it's getting more accurate"" is ridiculous. It has been accurate for YEARS. You've just finally acknowledged it.",Its been accurate for centuries,6,348
This song has aged well. In the worst way possible. Smh.,I know have you heard of the cop kneeling on the black mans neck while he said he couldn’t breathe but the cop kneeled harder,3,323
0:52 WTF you killed guy,yeah,1,0
Can't believe this was 2 years ago. Still entertaining and interesting,Where's the time going?,25,2206
This song hit mad different in 2020,Moistmelon Zach And during Quarantine,38,2948
Biden won!,OMG I HAVEN'T CHECKED BUT THANK GOD,4,8
The fact that it’s 2 years later but this song is more important now than ever.. I see you. I hear you. I mourn with you. I stand with you!!! #blacklivesmatter #togetherwerise,How to help: tell everyone to watch the 13th Documentary on YouTube by Netflix!,1,225
For the ppl viewing this: The message behind the song is the problem of BLACK on BLACK violence in America.,No lmao it all the problems  in the country,2,1
Remember WHO made America this way,Hint:They ain’t white,2,2
"childish gambino: *kills 17 people in this song*
also him: _its time to get funky_",oh boy that FONKEH,45,3391
Justice for João Pedro. Justice for George Floyd. Justice for Breonna Taylor. Justice for every black person that has ever died on this planet due to racism.,"Racism, and just general police brutality. Justice for Daniel Shaver!",13,444
Honestly the facial and body movements of Donald are insanely artistic..,It’s supposed to be stereotypical,27,5862
"More than 2 years later, this song is still relevant to the U.S. Actually quite sad.",Yes :c,499,59539
I think this song is more American than American national anthem.,No,127,13106
Who is watching this from self quarantine in 2020?,Yup,72,2702
And notice how he DIDN’T say the N-word.,",':^)",246,12627
"There is alot of symbolism in this video. for example: He shot the guy like that because he was imitating jim crow, a cartoon black imagery promoting racism.
His pants are that of the confederate army uniform.

Dance distracted from the riots and violence, we look to media to be entertained and dont focus on tragedy.
70-80s model cars abandoned, symbolizes how we've stopped progressing, ""racism is over"" and there has been no growth since, when  there is still much to be rectified.  

Smoked a joint as if to cope with the reality, and then dismisses it as if it never happened. 
Bag covered head shows that there are nameless faceless victims of violence, meant to be forgotten. 
Students recording from above with their cellphones instead of taking action, it also shows how when we see something happen we film it, and we don't intervene (Usually). The part where the choir singers were singing and he shot them all down was reffering to the charleston shooting, a crisis that happened in 2015.
 
There was also a white horse going by in the backround, In some cultures, white horses stand for the balance of wisdom and power. In others, like Christianity, the white horse is a symbol of death. The horse is a universal symbol of freedom without restraint, because riding a horse made people feel they could free themselves from their own bindings.
  
Also, I would have said that the use of the smiling and happy dancers was either more about (or in conjunction with the other messages) how we are happy to celebrate black culture -- their dance crazes, funny memes and entertainment -- except the moment it comes down to recognizing other parts of black culture, like rampant gun violence, racism and terror. ...then we don't care about it anymore. Black culture and black lives only matter when they're entertaining you, not when they're dying. Hope this helped everybody!",Government doesnt protect the 2nd A though...they are actively trying to take our guns away...restricting weapons doesnt make it any harder for criminals to get ahold of them,149,2695
"everyone: fornite dances
me and intelectual: jojo poses",Emily Patricia Garcia Canals 2020 hi I’m here to hi bye,1,8
Youtube recommended me something very relevant.,what's this song trying to say exactly,1,0
734.725 dislikes? Todo bien en casa?,A alguna Gente no le gusto el mensaje y listo,1,2
I remember when this song was number 1 and the riots weren’t a thing yet,Now they are...,5,663
"Ok so all the messages I can catch:
0:21 A man barefoot with an old guitar, representing the poor class black man
0:41 The Jim Crow faces, also he is dressed with gold chains and fancy pants but shirtless, maybe representing the middle class or America itself?
0:50 The gun pops out of knowhere, how easy you can get guns, he is with his head covered becouse it can be anyone and you don't know who
0:55 Gives the gun to the kid (school shootings)
1:10 The viral dances and memes, how our society doesn't cares of all the chaos around us
1:56 Charleston Massacre
2:00 All the police cars in the video are empty, representing how police does nothing to stop the chaos happening in the country
2:28 The people that instead of helping just record everything in their phones to get some views
2:37 The white horse representing the Apocalypse
3:24 After all the chaos, this place is empty, representing how calm or messy can be the U.S, also the music tells this by mixing the trap and gospel 
3:54 The place looks very dark here on purpose, repressenting how black people are still in the shadows like an ethnic group",Damn,67,1517
"This is america, where the words ""I cant breathe"" are not understood","they were absolutely understood. i would’ve tackled the prick, but hindsight and actually being there are very different than watching on a screen. why haven’t we poured over the white house like that scene in Lord of the Rings: RotK when Aragon returned with those ghosts? power in numbers.",6,430
children with masks? people of color in protests? murders? this looks like prophecy for 2020,Hotel? Trivago,45,2634
"My team's aim in siege: 0:48
Enemy team's aim in siege: 1:56",How I look to a doc spawnpeeking: 3:13,1,0
"Cops: running around, trying to find the murderer
Murderer: dancing in the middle of it all",I wonder who it is definitely not the one dancing when someone was murdered,12,3161
Is this the same guy who made *redbone*,No,1,2
this song explains perfectly the situation in america currently,"Not just currently it was like this for a long time, the only difference is that know a lot of people saw what happened this will keep happening and it will not stop unfortunately.",29,1882
Who’s after George Floyd death.. this is basically what’s going on right now! 2:27 they are wearing mask & recording 😳 y’all better wake tf up!,Chill bro..u better chill:hundred_points::eye::glowing_star::eye:I see where u goin wit that shit,2,117
"This is America ...

...I can’t breathe.",this ain’t america it’s a comment section,34,2478
Rest in peace to all the innocent black people killed due to racism. Black lives matter!,Lotte Whit this song isn’t about that....,13,488
"2020. It’s truly disgusting that people can’t understand we’re all equal. Nobody chooses skin color or race. We are all people and everyone deserves rights. We really haven’t changed since history. Black people shouldn’t be scared to go out or just live a normal life. People are protesting now and cops are shooting, tear gassing, and arresting people for it. That’s awful. What happened to George Floyd was disgusting. He should have life in prison. Now there bringing military into this for people just protesting for what’s right. The president is hiding and doing nothing. What has America come to? This song is amazing. BLACK LIVES MATTER ✊🏽✊🏾✊🏿","PREACH! Why is ending racism so controversial??? BLACK LIVES MATTER, FUCK RACISTS",55,1847
"*shot*
""This is america"" at the beginning got me... but still
it has a good impact",lol,21,2675
"shout their names for the entire world to hear. George Floyd
Trayvon Martin
Breonna Taylor
Ahmaud Arbery
Tamir Rice
Oscar Grant
Eric Garner
Philando Castile
Samuel Dubose
Sandra Bland
Walter Scott
Terrence Crutcher","Nobody important, just useful deaths for your shitty political movement.",24,348
DAMN.,I see what you did there :winking_face:,40,3328
"This def needs a sequel by the end of this year, black man shot for jogging, people protesting during a pandemic and a president telling us to try injecting ourselves with disinfectants",Yes. We need to start calling out ceiling gang. Cringe.,38,2118
Everyone inside America thinks there the best country. But everyone outside America knows they are the worst.,"Actually i wanted to live in America since I was little,but with all the shit that's going on,my mind was completely changed",30,238
"Another man in America is daed because black, this is horribile,i'm from italy and in my country the people is very upset  by this tragic episode .We are outraged,justice for George",It's so embarrassing to be American at this point:pensive_face:,17,236
im not black but i hear you. im not black but i hear you and mourn with you. no freedom until we're equal ✌🏻✌🏽✌🏿 #blacklivesmatter,Same I really hope that things change. That everyone can live in freedom and are treated equally. I am praying for the future!,12,354
Good new: Biden won,Terrible,1,2
What country is this again?,Iran?,1,2
Did Dad make the dance for this? I feel like I heard him in the background on the adlibs,Dax* not dad ctfu,1,0
this needs to be shown in schools during history class.,Yes,4,133
"*rest in peace all the angels who died at the hands of racism, we will do justice* ❤️🙏
🕊️👶🏼👶🏽👶🏾👶🏿🕊️    🖤✊🏼✊🏽✊🏾✊🏿🖤",Ooooo shit,9,541
This is still America,Sad but true,2,294
735k people who disliked are the same people who voted for trump in 2020.,You are so Sad. Sick from that Idiot President Trump and the TV.  Pathetic.,1,1
Can't believe this is older than a year old already,I know people younger than this song,21,2638
"Who’s here because of the murders of Ahmaud Arbery and Sean Reed? This Is America.

Edit: Now George Floyd. There’s something wrong with America when I have to add another name due to police brutality.",I am :(,70,2371
"Me looking at all the empty shelves at the grocery store.

*This is America*","kimicheeks ;I do not have to be subject to fear. 
Have confidence in God! Whatever you give attention to becomes big in your life. 

Isaiah 54:14 
No fear, no terror, no doubt. Worry lowers immunity",31,1930
"Mom: Why are you wearing a bulletproof vest to school?

Me: *THIS IS AMERICA*

Thanks for the likes lol 😂","Ridiculous country, all people I know who went to America said, americans are stupid.
Just look at their President, I never saw such a cringy, racist president who has orange skincancer color.",50,1861
"America: Attacks Iran
Iran: Why
America: This is America","Iran: No it isn't!
America: *It is now*",92,5769
"No matter how many times I watch this, it'll never get old. The energetic choreography, all the subtle messages throughout the background, and sometimes in front of your face, and just how COOL the song itself is! Donald Glover is always KILLIN' it!!!!!",I can sense my mothers disappointment in me . It has hidden messages and it’s kinda spooky. Search a video of the hidden meanings.,5,379
"As a black artist sending a message, when you accrue 733K+ haters, you're most likely doing something right.","Convey a message, while making an extremely good song.",17,455
WORLD WAR 3 THEME SONG OF AMERICA,Adventures of Adrìan :skull:,5,312
"Irán: why???
USA: THIS IS AMERICA",Stolen I mean how you gonna steel one of the most likes comments and then expect people to act like you didn’t steel the comment,10,367
"Man wrestles crocodile because it stole his Vegemite sandwich




THIS IS AUSTRALIA",Vegemite?,13,596
The only Donald we need in this country,ikr,1,24
"This song is still relevant in 2020, just shows we havent changed at all.",Yes America is getting more drugs,12,356
The dancers’ outfits are reminiscent of the type of clothing worn by the Little Rock Nine and other African American teens who participated in  integrating schools in the 50s.,"Huh no wonder 
I was thinking about it how the clothes present how even with education black people still are hired less, makes a whole lot of sense
Thanks for reminding me",2,64
I’m back 9 months later 😭🔥,Gay Davine Jay this is america,64,3743
This is how the world looks at USA,And I blame violent rap. It's so annoying that we choose to make celebrities out of people who rap about being selfish and murderous. Then we wonder why the world hates us. And this song is not helping. Yes we get the messages here but to a foreign country this song totally looks like we are proud of our violent culture in hiphop. All because these adult kids wanna play bad boys they end up making us look like violent animals because the other adult kids also want to play bad boys and so make super stars out of idiots.,1,25
Probably my 27th time watching this...still get goosebumps.,Azerrz doubt it,8,111
THIS IS AMERICA BLACK LIVES MATTER,yes,1,4
The dislikes are from trump supporters,Wtf,2,6
"people need to understand that this song didnt “predict the future”...... it brought up issues and spoke about police brutality, favoring guns over lives, racial profiling, racism in general, and so much more which have all existed for CENTURIES!",...true...but the young people with face masks though,56,1826
oh shit was that really sza at the end? this video is legendary,yes it really was,24,2638
"Nada:

absolutamente nada:

Tic tok: This is american",Aleluia br/pt !!!!! Já tava me sentindo sozinha kakakkaka,1,12
Soooooo are we gonna ignore the fact that this song actually came out 2017 and not 2018???....these glitches are getting worse this year,"This was uploaded after the release. Not a glitch, just didn't come out with the song.",2,3
You know you've been on the internet too long when the... *OTHER* version of this song is all you can hear.,Boa tarde :bouquet:,1,1
"SAY THEIR NAMES....

Billy Ray Davis, La'vante Biggs, Calin Roquemore, Dyzhawn Perkins, Christopher Davis, Marco Loud, Natasha McKenna, George Floyd, Eric Garner, Michael Lee Marshall, Tony Robinson, Anthony Hill, Mya Hall, Phillip White, Samuel Dubose, Michael Sabboe, Jamar Clark, Tamir Rice, Richard Perkins, Brian Keith Day, Christian Taylor, Troy Robinson, Ashams Pharaoh Manley, Michael Brown, Nathaniel Harris Pickett, Peter Gaines, Sandra Bland, Benni LEe Tignor, Michael Espinal, Torrey Robinson, Darius Robinson, Eric Harris, Ezell Ford, Walter Scott, Dante Parker, Felix Kumi, Michael Noel, Kevin Hicks, William Chapman II, Alexia Christian, Michelle Cusseaux, Kevin Matthews, Mary Truxillo, Demarcus Semer, Keith Harrison McLeod, Laquan McDonald, Bettie Jones, Junior Prosper, Lamontez Jones, Brendon Glenn, Tanisha Anderson, Víctor Manuel Larosa, Quintonio Leggier, Willie Tillman, Akai Gurley, Paterson Brown, Keith Childress Jr., Terrill Thomas, Jonathan Sanders, Rumain Brisbon, Janet Wilson, Sylville Smith, Alton Sterling, Freddie Blue, Dominic Hutchinson, Jerame Reid, George Mann, Matthew Ajibade, Joseph Mann, Salvado Ellswood, Anthony Ashford, Alonzo Smith, Randy Nelson, Antronie Scott, Philando Castile, Tyree Crawford, India Kager, Pamela Turner, Wendell Celestine, Terrence Crutcher, Albert Joseph, Davis Darrius, Stewart Frank Smart, David Joseph, Paul O'Neal, Breonna Taylor, Ronnell Foster, Alteria Woods, Christopher Mccorvey, Eric Reason, Stephon Clark, Antwon Rose II, John Crawford III, Dominique Clayton, Atatiana Jefferson, Jordan Edwards, Christopher Whitfield, Michael Lorenzo Dean, and Aaron Bailey. #nojusticenopeace #BLACKLIVESMATTER",mara jay all were niggas,30,651
Even though I love all of Gambino's work I like this song specifically because it reflects his earlier work like camp where he also used music and song to show serious problems in the world,Yeah true. It feels very Bino-ish without even being about him,1,2
"Notice how the dancing catches your eye throughout the video? He’s distracting us from the chaos going in the background. I bet you didn’t even notice that dude riding the horse at the end. It’s a good representation of what people in America do today. They blind us by telling us “Oh yes America is wonderful! We have nice cars and houses, we have beautiful spots for you to discover!” But beneath that?? Blatant racism, homophobia, transphobia, ableism, and misogyny. This is America.",Omg yessssssss,6,15
"It’s not whites vs blacks, it’s everyone vs racists. This is America.",EXACTLY. it's not a race war.,250,11658
I just figured out childish gambino and donald glover are the same person...,Lol,1,2
"0:53

Who remembers that this was a meme😂😂😂😂",ThanksIHateBTS,1,1
"Man, the director of this did a really nice job. I really liked the oddness of the video, adds a lot to the music.",Same director who did Clapping for the Wrong Reasons and Atlanta.,37,4093
Who else is here after Minneapolis police applied pressure on a George Floyds neck until he died.,"I normally support the police because they protect us and allow us to keep our freedom however I will say that George Floyd’s death should not have happened and that there definitely are some racist cops out there. Most aren’t, but still, there shouldn’t be any.",480,137508
"rest in peace george floyd, and to all black men and women that were brutally murdered or abused by law enforcement. i’m not black, but i see you. im not black, but i hear you. im not black, but i mourn with you. ✊🏿✊🏾✊🏽",Thanks :thumbs_up_medium_skin_tone:,72,1494
"They were just singing, and this guy without a T-short shooted them...
*Yeah, I think this is America*",Kubra that’s gangster,3,6
"i love this music video, especially when he kills them",same,1,1
Who’s here after Floyd’s murder by Minneapolis cops,JUSTICE FOR GEORGE FLOYD :raised_fist_medium-dark_skin_tone::raised_fist_medium-dark_skin_tone::raised_fist_medium-dark_skin_tone:,163,7820
"He is a king he predicted the future
*This is America*",WHYY,2,2
I never listened to this song when it first came out. Listening to this actually is a good representation of America. I swear as soon as I turn 18 I’m moving to Canada,Latin America: ._. XD,1,4
All the dislikes are from children who don’t know how much danger black people are in.,Yes,3,25
How election day is gonna be,Yesterday was election day,1,2
It’s not blacks against racism it’s everyone against racism!,It's white vs non white.,8,136
So now white kids on tik tok are totally missing the point of this vid to throw pity parties LMAO,I saw someone mentioned that TikTok made this song famous and I checked in out...do they seriously not get the irony. He makes references to the fact that these violent things happen but hey lets party and dance,4,138
I just noticed SZA was in this,Me too,1,2
"Eminem:diss rappers 








Childish Gambino:diss America",Diss is america,298,62822
Everytime a mass shooting happens in America we will comeback to this video,@MR. Right yea,37,1722
"Throws some tea in the sea:
*This is America*",That was terrorism during it's time.,34,4941
"*_""Racism is not getting worse ... It is being recorded.""_*

*-Will Smith*",:0,56,953
Came to watch again after another senseless death by a police officer. Anyone else?,Yes,143,10253
"R.I.P Ahmaud Arbery
Edit: R.I.P George Floyd",#justiceforahmaudarbery,48,676
"Teacher - why did you come to school without a shirt 


Me - this is America",Oh no...,69,9887
The dislikes are from angry Americans that refuse to believe this is true,You do know that people that arent from america can dislike it right?,13,471
This song is defintely explaining whats going on in America right now,"not only in america, but in the hole world",2,118
"Columbus : This is India?
Americans : This is America.",Lmao,38,5052
I've changed this comment so you'll never know how I got so many likes.,Great neme,26,1535
Right now ESPN and the NFL are using George Floyd and Colin Kaepernick in their ads... after they ruined Kaepernick's career for peacefully protesting. This is America.,all the world with you #blacklivesmatter support from iraq,4,250
"I also just noticed when he says, Don't catch you slippin now the first time, he looks away angry, but then turns to face the camera with an exaggerated smile on his face the second time he says it.","what does ""don't catch you slippin now"" mean?",1,1
Just watched a white man in a police uniform murder George Floyd in broad daylight as people stood around and watched and live streamed.  This is America.,It makes my blood boil.,6,184
"Notice how everyone was still dancing while shit was happening in the back, that’s a representation of how the media tries to distract everyone with fun stuff while real things are happening on the earth","Yesss, speak on the truth...the brainwashed will portray this video as violent not appropriate for tv...smh!",7,456
honestly the choreographer for this video is god tier,Yeah this such a good music video,7,1196
"people saying this is becoming more and more accurate. that's not true, it was always accurate it's just in front of the world now",Yea they must have been living in a bubble,4,297
**I don't understand school shooting memes..maybe they are aimed at a younger audience.**,This comment was slept on,220,22036
The way this aged is sadly true. This is America,It’s been like this all along:broken_heart: people just didn’t realise till now,5,508
"Since this song has released, barely anything has changed 😔





*_R.I.P George Floyd xxxx_*",Sadly. It’s very heartbreaking,3,205
"Its soo insane that they named *2 CONTINENTS* ""America"" because of this song",No,452,41265
XD NADIE HABLA ESPAÑOL,Ya ves,1,2
"Me: Mom why is there a person without a shirt dancing as hell?

My mom: *_Americans_*",hahahhahaahhaha Focked!,10,1231
"American: boarding up stores the day before the presidential election
Why: “this is America”",:expressionless_face::black_heart:,3,676
"People are saying ""he predicted 2020"" no he didn't this is has happening for hundreds of years and still hasn't fixed itself, No justice No peace.",F A C T S,5,273
"POV: The votes are all in, the 46th president of the USA is decided, everyone loses it, riots break out, looting, killing, the beginning of the downfall of this entire country. Civil War 2. The camera slowly pans out as the beat to this song drops while the rest of the world watches and laughs.","Oh yeah i’m gonna laugh alright, y’all fucked in the head on a comedic level",42,309
"Me: *laughing at ww3 memes*
Also me: realising this isn't a mfing joke an even rappers was tryna worn us about the end of the world...","Fuck, dude",14,252
donald just letting us know hes talented at every single thing hes ever done,FG I’m so fucking excited for this new wave. The song on SNL was pure old Gambino funk vibes as well :fire:,18,2330
This is gonna be nostalgic one day  and that scares me,Not if you die today,3,96
